Rank|Metascore,Title & Year,Genre1,Genre2,Genre3,Director FirstN,Director SecondN,Actor1,Actor2,Actor3,Actor4,Runtime (Minutes),Revenue (Millions),Rating|Votes|Metascore,Description
Rank:469 Metascore:81,District 9 (2009),Action,Sci-Fi,Thriller,Neill,Blomkamp,Sharlto Copley, David James, Jason Cope, Nathalie Boltt,112,115.65,8|556794|81,An extraterrestrial race forced to live in slum-like conditions on Earth suddenly finds a kindred spirit in a government agent who is exposed to their biotechnology.
Rank:470 Metascore:64,The Other Guys (2010),Action,Comedy,Crime,Adam,McKay,Will Ferrell, Mark Wahlberg, Derek Jeter, Eva Mendes,107,119.22,6.7|199900|64,Two mismatched New York City detectives seize an opportunity to step up like the city's top cops whom they idolize -- only things don't quite go as planned.
Rank:471 Metascore:76,American Gangster (2007),Biography,Crime,Drama,Ridley,Scott,Denzel Washington, Russell Crowe, Chiwetel Ejiofor,Josh Brolin,157,130.13,7.8|337835|76,"In 1970s America, a detective works to bring down the drug empire of Frank Lucas, a heroin kingpin from Manhattan, who is smuggling the drug into the country from the Far East."
Rank:472 Metascore:65,Marie Antoinette (2006),Biography,Drama,History,Sofia,Coppola,Kirsten Dunst, Jason Schwartzman, Rip Torn, Judy Davis,123,15.96,6.4|83941|65,"The retelling of France's iconic but ill-fated queen, Marie Antoinette. From her betrothal and marriage to Louis XVI at 15 to her reign as queen at 19 and to the end of her reign as queen, and ultimately the fall of Versailles."
Rank:473 Metascore:49,2012 (2009),Action,Adventure,Sci-Fi,Roland,Emmerich,John Cusack, Thandie Newton, Chiwetel Ejiofor,Amanda Peet,158,166.11,5.8|297984|49,A frustrated writer struggles to keep his family alive when a series of global catastrophes threatens to annihilate mankind.
Rank:474 Metascore:78,Harry Potter and the Half-Blood Prince (2009),Adventure,Family,Fantasy,David,Yates,Daniel Radcliffe, Emma Watson, Rupert Grint, Michael Gambon,153,301.96,7.5|351059|78,"As Harry Potter begins his sixth year at Hogwarts, he discovers an old book marked as ""the property of the Half-Blood Prince"" and begins to learn more about Lord Voldemort's dark past."
Rank:475 Metascore:86,Argo (2012),Biography,Drama,History,Ben,Affleck,Ben Affleck, Bryan Cranston, John Goodman, Alan Arkin,120,136.02,7.7|481274|86,"Acting under the cover of a Hollywood producer scouting a location for a science fiction film, a CIA agent launches a dangerous operation to rescue six Americans in Tehran during the U.S. hostage crisis in Iran in 1980."
Rank:476 Metascore:54,Eddie the Eagle (2016),Biography,Comedy,Drama,Dexter,Fletcher,Taron Egerton, Hugh Jackman, Tom Costello, Jo Hartley,106,15.79,7.4|56332|54,"The story of Eddie Edwards, the notoriously tenacious British underdog ski jumper who charmed the world at the 1988 Winter Olympics."
Rank:477 Metascore:89,The Lives of Others (2006),Drama,Thriller,,Florian,Henckel von Donnersmarck,Ulrich Mühe, Martina Gedeck,Sebastian Koch, Ulrich Tukur,137,11.28,8.5|278103|89,"In 1984 East Berlin, an agent of the secret police, conducting surveillance on a writer and his lover, finds himself becoming increasingly absorbed by their lives."
Rank:478 Metascore:48,Pet (2016),Horror,Thriller,,Carles,Torrens,Dominic Monaghan, Ksenia Solo, Jennette McCurdy,Da'Vone McDonald,94,,5.7|8404|48,"A psychological thriller about a man who bumps into an old crush and subsequently becomes obsessed with her, leading him to hold her captive underneath the animal shelter where he works. ... See full summary »"
Rank:479 Metascore:71,Paint It Black (2016),Drama,,,Amber,Tamblyn,Alia Shawkat, Nancy Kwan, Annabelle Attanasio,Alfred Molina,96,,8.3|61|71,A young woman attempts to deal with the death of her boyfriend while continuously confronted by his mentally unstable mother.
Rank:480 Metascore:71,Macbeth (2015),Drama,War,,Justin,Kurzel,Michael Fassbender, Marion Cotillard, Jack Madigan,Frank Madigan,113,,6.7|41642|71,"Macbeth, the Thane of Glamis, receives a prophecy from a trio of witches that one day he will become King of Scotland. Consumed by ambition and spurred to action by his wife, Macbeth murders his king and takes the throne for himself."
Rank:481 Metascore:67,Forgetting Sarah Marshall (2008),Comedy,Drama,Romance,Nicholas,Stoller,Kristen Bell, Jason Segel, Paul Rudd, Mila Kunis,111,62.88,7.2|226619|67,"Devastated Peter takes a Hawaiian vacation in order to deal with the recent break-up with his TV star girlfriend, Sarah. Little does he know, Sarah's traveling to the same resort as her ex - and she's bringing along her new boyfriend."
Rank:482 Metascore:47,The Giver (2014),Drama,Romance,Sci-Fi,Phillip,Noyce,Brenton Thwaites, Jeff Bridges, Meryl Streep, Taylor Swift,97,45.09,6.5|93799|47,"In a seemingly perfect community, without war, pain, suffering, differences or choice, a young boy is chosen to learn from an elderly man about the true pain and pleasure of the ""real"" world."
Rank:483 Metascore:52,Triple 9 (2016),Action,Crime,Drama,John,Hillcoat,Casey Affleck, Chiwetel Ejiofor, Anthony Mackie,Aaron Paul,115,12.63,6.3|48400|52,A gang of criminals and corrupt cops plan the murder of a police officer in order to pull off their biggest heist yet across town.
Rank:484 Metascore:43,Perfetti sconosciuti (2016),Comedy,Drama,,Paolo,Genovese,Giuseppe Battiston, Anna Foglietta, Marco Giallini,Edoardo Leo,97,,7.7|17584|43,"Seven long-time friends get together for a dinner. When they decide to share with each other the content of every text message, email and phone call they receive, many secrets start to unveil and the equilibrium trembles."
Rank:485 Metascore:,Angry Birds (2016),Animation,Action,Adventure,Clay,Kaytis,Jason Sudeikis, Josh Gad, Danny McBride, Maya Rudolph,97,107.51,6.3|55781|,"Find out why the birds are so angry. When an island populated by happy, flightless birds is visited by mysterious green piggies, it's up to three unlikely outcasts - Red, Chuck and Bomb - to figure out what the pigs are up to."
Rank:486 Metascore:84,Moonrise Kingdom (2012),Adventure,Comedy,Drama,Wes,Anderson,Jared Gilman, Kara Hayward, Bruce Willis, Bill Murray,94,45.51,7.8|254446|84,"A pair of young lovers flee their New England town, which causes a local search party to fan out to find them."
Rank:487 Metascore:81,Hairspray (2007),Comedy,Drama,Family,Adam,Shankman,John Travolta, Queen Latifah, Nikki Blonsky,Michelle Pfeiffer,117,118.82,6.7|102954|81,Pleasantly plump teenager Tracy Turnblad teaches 1962 Baltimore a thing or two about integration after landing a spot on a local TV dance show.
Rank:488 Metascore:34,Safe Haven (2013),Drama,Romance,Thriller,Lasse,Hallström,Julianne Hough, Josh Duhamel, Cobie Smulders,David Lyons,115,71.35,6.7|84765|34,"A young woman with a mysterious past lands in Southport, North Carolina where her bond with a widower forces her to confront the dark secret that haunts her."
Rank:489 Metascore:56,Focus (2015),Comedy,Crime,Drama,Glenn,Ficarra,Will Smith, Margot Robbie, Rodrigo Santoro, Adrian Martinez,105,53.85,6.6|166489|56,"In the midst of veteran con man Nicky's latest scheme, a woman from his past - now an accomplished femme fatale - shows up and throws his plans for a loop."
Rank:490 Metascore:96,Ratatouille (2007),Animation,Comedy,Family,Brad,Bird,Brad Garrett, Lou Romano, Patton Oswalt,Ian Holm,111,206.44,8|504039|96,A rat who can cook makes an unusual alliance with a young kitchen worker at a famous restaurant.
Rank:491 Metascore:66,Stake Land (2010),Drama,Horror,Sci-Fi,Jim,Mickle,Connor Paolo, Nick Damici, Kelly McGillis, Gregory Jones,98,0.02,6.5|36091|66,Martin was a normal teenage boy before the country collapsed in an empty pit of economic and political disaster. A vampire epidemic has swept across what is left of the nation's abandoned ... See full summary »
Rank:492 Metascore:53,The Book of Eli (2010),Action,Adventure,Drama,Albert,Hughes,Denzel Washington, Mila Kunis, Ray Stevenson, Gary Oldman,118,94.82,6.9|241359|53,"A post-apocalyptic tale, in which a lone man fights his way across America in order to protect a sacred book that holds the secrets to saving humankind."
Rank:493 Metascore:64,Cloverfield (2008),Action,Horror,Sci-Fi,Matt,Reeves,Mike Vogel, Jessica Lucas, Lizzy Caplan, T.J. Miller,85,80.03,7|313803|64,A group of friends venture deep into the streets of New York on a rescue mission during a rampaging monster attack.
Rank:494 Metascore:34,Point Break (2015),Action,Crime,Sport,Ericson,Core,Edgar Ramírez, Luke Bracey, Ray Winstone, Teresa Palmer,114,28.77,5.3|44553|34,"A young FBI agent infiltrates an extraordinary team of extreme sports athletes he suspects of masterminding a string of unprecedented, sophisticated corporate heists."
Rank:495 Metascore:78,Under the Skin (2013),Drama,Horror,Sci-Fi,Jonathan,Glazer,Scarlett Johansson, Jeremy McWilliams, Lynsey Taylor Mackay, Dougie McConnell,108,2.61,6.3|94707|78,"A mysterious young woman seduces lonely men in the evening hours in Scotland. However, events lead her to begin a process of self-discovery."
Rank:496 Metascore:65,I Am Legend (2007),Drama,Horror,Sci-Fi,Francis,Lawrence,Will Smith, Alice Braga, Charlie Tahan, Salli Richardson-Whitfield,101,256.39,7.2|565721|65,"Years after a plague kills most of humanity and transforms the rest into monsters, the sole survivor in New York City struggles valiantly to find a cure."
Rank:497 Metascore:58,Men in Black 3 (2012),Action,Adventure,Comedy,Barry,Sonnenfeld,Will Smith, Tommy Lee Jones, Josh Brolin,Jemaine Clement,106,179.02,6.8|278379|58,Agent J travels in time to M.I.B.'s early days in 1969 to stop an alien from assassinating his friend Agent K and changing history.
Rank:498 Metascore:72,Super 8 (2011),Mystery,Sci-Fi,Thriller,J.J.,Abrams,Elle Fanning, AJ Michalka, Kyle Chandler, Joel Courtney,112,126.98,7.1|298913|72,"During the summer of 1979, a group of friends witness a train crash and investigate subsequent unexplained events in their small town."
Rank:499 Metascore:34,Law Abiding Citizen (2009),Crime,Drama,Thriller,F. Gary,Gray,Gerard Butler, Jamie Foxx, Leslie Bibb, Colm Meaney,109,73.34,7.4|228339|34,A frustrated man decides to take justice into his own hands after a plea bargain sets one of his family's killers free. He targets not only the killer but also the district attorney and others involved in the deal.
Rank:500 Metascore:88,Up (2009),Animation,Adventure,Comedy,Pete,Docter,Edward Asner, Jordan Nagai, John Ratzenberger, Christopher Plummer,96,292.98,8.3|722203|88,"Seventy-eight year old Carl Fredricksen travels to Paradise Falls in his home equipped with balloons, inadvertently taking a young stowaway."
Rank:501 Metascore:43,Maze Runner: The Scorch Trials (2015),Action,Sci-Fi,Thriller,Wes,Ball,Dylan O'Brien, Kaya Scodelario, Thomas Brodie-Sangster,Giancarlo Esposito,131,81.69,6.3|159364|43,"After having escaped the Maze, the Gladers now face a new set of challenges on the open roads of a desolate landscape filled with unimaginable obstacles."
Rank:502 Metascore:95,Carol (2015),Drama,Romance,,Todd,Haynes,Cate Blanchett, Rooney Mara, Sarah Paulson, Kyle Chandler,118,0.25,7.2|77995|95,An aspiring photographer develops an intimate relationship with an older woman in 1950s New York.
Rank:503 Metascore:68,Imperium (2016),Crime,Drama,Thriller,Daniel,Ragussis,Daniel Radcliffe, Toni Collette, Tracy Letts, Sam Trammell,109,,6.5|27428|68,"A young FBI agent, eager to prove himself in the field, goes undercover as a white supremacist."
Rank:504 Metascore:64,Youth (2015),Comedy,Drama,Music,Paolo,Sorrentino,Michael Caine, Harvey Keitel, Rachel Weisz, Jane Fonda,124,2.7,7.3|52636|64,A retired orchestra conductor is on holiday with his daughter and his film director best friend in the Alps when he receives an invitation from Queen Elizabeth II to perform for Prince Philip's birthday.
Rank:505 Metascore:63,Mr. Nobody (2009),Drama,Fantasy,Romance,Jaco,Van Dormael,Jared Leto, Sarah Polley, Diane Kruger, Linh Dan Pham,141,,7.9|166872|63,"A boy stands on a station platform as a train is about to leave. Should he go with his mother or stay with his father? Infinite possibilities arise from this decision. As long as he doesn't choose, anything is possible."
Rank:506 Metascore:54,City of Tiny Lights (2016),Crime,Drama,Thriller,Pete,Travis,Riz Ahmed, Billie Piper, James Floyd, Cush Jumbo,110,,5.7|291|54,"In the teeming, multicultural metropolis of modern-day London, a seemingly straightforward missing-person case launches a down-at-heel private eye into a dangerous world of religious fanaticism and political intrigue."
Rank:507 Metascore:59,Savages (2012),Crime,Drama,Thriller,Oliver,Stone,Aaron Taylor-Johnson, Taylor Kitsch, Blake Lively,Benicio Del Toro,131,47.31,6.5|107960|59,Pot growers Ben and Chon face off against the Mexican drug cartel who kidnapped their shared girlfriend.
Rank:508 Metascore:76,(500) Days of Summer (2009),Comedy,Drama,Romance,Marc,Webb,Zooey Deschanel, Joseph Gordon-Levitt, Geoffrey Arend, Chloë Grace Moretz,95,32.39,7.7|398972|76,"An offbeat romantic comedy about a woman who doesn't believe true love exists, and the young man who falls for her."
Rank:509 Metascore:18,Movie 43 (2013),Comedy,Romance,,Elizabeth,Banks,Emma Stone, Stephen Merchant, Richard Gere, Liev Schreiber,94,8.83,4.3|83625|18,A series of interconnected short films follows a washed-up producer as he pitches insane story lines featuring some of the biggest stars in Hollywood.
Rank:510 Metascore:96,Gravity (2013),Drama,Sci-Fi,Thriller,Alfonso,Cuarón,Sandra Bullock, George Clooney, Ed Harris, Orto Ignatiussen,91,274.08,7.8|622089|96,Two astronauts work together to survive after an accident which leaves them alone in space.
Rank:511 Metascore:55,The Boy in the Striped Pyjamas (2008),Drama,War,,Mark,Herman,Asa Butterfield, David Thewlis, Rupert Friend, Zac Mattoon O'Brien,94,9.03,7.8|144614|55,"Set during WWII, a story seen through the innocent eyes of Bruno, the eight-year-old son of the commandant at a German concentration camp, whose forbidden friendship with a Jewish boy on the other side of the camp fence has startling and unexpected consequences."
Rank:512 Metascore:53,Shooter (2007),Action,Crime,Drama,Antoine,Fuqua,Mark Wahlberg, Michael Peña, Rhona Mitra, Danny Glover,124,46.98,7.2|267820|53,"A marksman living in exile is coaxed back into action after learning of a plot to kill the President. Ultimately double-crossed and framed for the attempt, he goes on the run to find the real killer and the reason he was set up."
Rank:513 Metascore:34,The Happening (2008),Sci-Fi,Thriller,,M. Night,Shyamalan,Mark Wahlberg, Zooey Deschanel, John Leguizamo, Ashlyn Sanchez,91,64.51,5|170897|34,"A science teacher, his wife, and a young girl struggle to survive a plague that causes those infected to commit suicide."
Rank:514 Metascore:72,Bone Tomahawk (2015),Adventure,Drama,Horror,S. Craig,Zahler,Kurt Russell, Patrick Wilson, Matthew Fox, Richard Jenkins,132,66.01,7.1|47289|72,Four men set out in the Wild West to rescue a group of captives from cannibalistic cave dwellers.
Rank:515 Metascore:60,Magic Mike XXL (2015),Comedy,Drama,Music,Gregory,Jacobs,Channing Tatum, Joe Manganiello, Matt Bomer,Adam Rodriguez,115,,5.7|42506|60,"Three years after Mike bowed out of the stripper life at the top of his game, he and the remaining Kings of Tampa hit the road to Myrtle Beach to put on one last blow-out performance."
Rank:516 Metascore:72,Easy A (2010),Comedy,Drama,Romance,Will,Gluck,Emma Stone, Amanda Bynes, Penn Badgley, Dan Byrd,92,58.4,7.1|294950|72,A clean-cut high school student relies on the school's rumor mill to advance her social and financial standing.
Rank:517 Metascore:52,Exodus: Gods and Kings (2014),Action,Adventure,Drama,Ridley,Scott,Christian Bale, Joel Edgerton, Ben Kingsley, Sigourney Weaver,150,65.01,6|137299|52,"The defiant leader Moses rises up against the Egyptian Pharaoh Ramses, setting 600,000 slaves on a monumental journey of escape from Egypt and its terrifying cycle of deadly plagues."
Rank:518 Metascore:41,Chappie (2015),Action,Crime,Drama,Neill,Blomkamp,Sharlto Copley, Dev Patel, Hugh Jackman,Sigourney Weaver,120,31.57,6.9|188769|41,"In the near future, crime is patrolled by a mechanized police force. When one police droid, Chappie, is stolen and given new programming, he becomes the first robot with the ability to think and feel for himself."
Rank:519 Metascore:66,The Hobbit: The Desolation of Smaug (2013),Adventure,Fantasy,,Peter,Jackson,Ian McKellen, Martin Freeman, Richard Armitage,Ken Stott,161,258.36,7.9|513744|66,"The dwarves, along with Bilbo Baggins and Gandalf the Grey, continue their quest to reclaim Erebor, their homeland, from Smaug. Bilbo Baggins is in possession of a mysterious and magical ring."
Rank:520 Metascore:51,Half of a Yellow Sun (2013),Drama,Romance,,Biyi,Bandele,Chiwetel Ejiofor, Thandie Newton, Anika Noni Rose,Joseph Mawle,111,0.05,6.2|1356|51,"Sisters Olanna and Kainene return home to 1960s Nigeria, where they soon diverge on different paths. As civil war breaks out, political events loom larger than their differences as they join the fight to establish an independent republic."
Rank:521 Metascore:59,Anthropoid (2016),Biography,History,Thriller,Sean,Ellis,Jamie Dornan, Cillian Murphy, Brian Caspe, Karel Hermánek Jr.,120,2.96,7.2|24100|59,"Based on the extraordinary true story of Operation Anthropoid, the WWII mission to assassinate SS General Reinhard Heydrich, the main architect behind the Final Solution and the Reich's third in command after Hitler and Himmler."
Rank:522 Metascore:48,The Counselor (2013),Crime,Drama,Thriller,Ridley,Scott,Michael Fassbender, Penélope Cruz, Cameron Diaz,Javier Bardem,117,16.97,5.3|84927|48,A lawyer finds himself in over his head when he gets involved in drug trafficking.
Rank:523 Metascore:57,Viking (2016),Action,Drama,History,Andrey,Kravchuk,Anton Adasinsky, Aleksandr Armer, Vilen Babichev, Rostislav Bershauer,133,23.05,4.7|1830|57,"Kievan Rus, late 10th century. After the death of his father, the young Viking prince Vladimir of Novgorod is forced into exile across the frozen sea."
Rank:524 Metascore:,Whiskey Tango Foxtrot (2016),Biography,Comedy,Drama,Glenn,Ficarra,Tina Fey, Margot Robbie, Martin Freeman, Alfred Molina,112,,6.6|36156|,A journalist recounts her wartime coverage in Afghanistan.
Rank:525 Metascore:60,Trust (2010),Crime,Drama,Thriller,David,Schwimmer,Clive Owen, Catherine Keener, Liana Liberato,Jason Clarke,106,0.06,7|36043|60,A teenage girl is targeted by an online sexual predator.
Rank:526 Metascore:61,Birth of the Dragon (2016),Action,Biography,Drama,George,Nolfi,Billy Magnussen, Terry Chen, Teresa Navarro,Vanessa Ross,103,93.05,3.9|552|61,"Young, up-and-coming martial artist, Bruce Lee, challenges legendary kung fu master Wong Jack Man to a no-holds-barred fight in Northern California."
Rank:527 Metascore:,Elysium (2013),Action,Drama,Sci-Fi,Neill,Blomkamp,Matt Damon, Jodie Foster, Sharlto Copley, Alice Braga,109,,6.6|358932|,"In the year 2154, the very wealthy live on a man-made space station while the rest of the population resides on a ruined Earth. A man takes on a mission that could bring equality to the polarized worlds."
Rank:528 Metascore:38,The Green Inferno (2013),Adventure,Horror,,Eli,Roth,Lorenza Izzo, Ariel Levy, Aaron Burns, Kirby Bliss Blanton,100,7.19,5.4|26461|38,"A group of student activists travels to the Amazon to save the rain forest and soon discover that they are not alone, and that no good deed goes unpunished."
Rank:529 Metascore:62,Godzilla (2014),Action,Adventure,Sci-Fi,Gareth,Edwards,Aaron Taylor-Johnson, Elizabeth Olsen, Bryan Cranston, Ken Watanabe,123,200.66,6.4|318058|62,"The world is beset by the appearance of monstrous creatures, but one of them may be the only one who can save humanity."
Rank:530 Metascore:61,The Bourne Legacy (2012),Action,Adventure,Mystery,Tony,Gilroy,Jeremy Renner, Rachel Weisz, Edward Norton, Scott Glenn,135,113.17,6.7|245374|61,"An expansion of the universe from Robert Ludlum's novels, centered on a new hero whose stakes have been triggered by the events of the previous three films."
Rank:531 Metascore:47,A Good Year (2006),Comedy,Drama,Romance,Ridley,Scott,Russell Crowe, Abbie Cornish, Albert Finney, Marion Cotillard,117,7.46,6.9|74674|47,"A British investment broker inherits his uncle's chateau and vineyard in Provence, where he spent much of his childhood. He discovers a new laid-back lifestyle as he tries to renovate the estate to be sold."
Rank:532 Metascore:59,Friend Request (2016),Horror,Thriller,,Simon,Verhoeven,Alycia Debnam-Carey, William Moseley, Connor Paolo, Brit Morgan,92,64.03,5.4|12758|59,"When a college student unfriends a mysterious girl online, she finds herself fighting a demonic presence that wants to make her lonely by killing her closest friends."
Rank:533 Metascore:,Deja Vu (2006),Action,Sci-Fi,Thriller,Tony,Scott,Denzel Washington, Paula Patton, Jim Caviezel, Val Kilmer,126,,7|253858|,"After a ferry is bombed in New Orleans, an A.T.F. agent joins a unique investigation using experimental surveillance technology to find the bomber, but soon finds himself becoming obsessed with one of the victims."
Rank:534 Metascore:61,Lucy (2014),Action,Sci-Fi,Thriller,Luc,Besson,Scarlett Johansson, Morgan Freeman, Min-sik Choi,Amr Waked,89,126.55,6.4|352698|61,"A woman, accidentally caught in a dark deal, turns the tables on her captors and transforms into a merciless warrior evolved beyond human logic."
Rank:535 Metascore:77,A Quiet Passion (2016),Biography,Drama,,Terence,Davies,Cynthia Nixon, Jennifer Ehle, Duncan Duff, Keith Carradine,125,1.08,7.2|1024|77,"The story of American poet Emily Dickinson from her early days as a young schoolgirl to her later years as a reclusive, unrecognized artist."
Rank:536 Metascore:39,Need for Speed (2014),Action,Crime,Drama,Scott,Waugh,Aaron Paul, Dominic Cooper, Imogen Poots, Scott Mescudi,132,43.57,6.5|143389|39,"Fresh from prison, a street racer who was framed by a wealthy business associate joins a cross country race with revenge in mind. His ex-partner, learning of the plan, places a massive bounty on his head as the race begins."
Rank:537 Metascore:50,Jack Reacher (2012),Action,Crime,Mystery,Christopher,McQuarrie,Tom Cruise, Rosamund Pike, Richard Jenkins, Werner Herzog,130,58.68,7|250811|50,A homicide investigator digs deeper into a case involving a trained military sniper who shot five random victims.
Rank:538 Metascore:22,The Do-Over (2016),Action,Adventure,Comedy,Steven,Brill,Adam Sandler, David Spade, Paula Patton, Kathryn Hahn,108,0.54,5.7|24761|22,"Two down-on-their-luck guys decide to fake their own deaths and start over with new identities, only to find the people they're pretending to be are in even deeper trouble."
Rank:539 Metascore:43,True Crimes (2016),Crime,Drama,Thriller,Alexandros,Avranas,Jim Carrey, Charlotte Gainsbourg, Marton Csokas, Kati Outinen,92,,7.3|198|43,"A murder investigation of a slain business man turns to clues found in an author's book about an eerily similar crime. Based on the 2008 article ""True Crimes - A postmodern murder mystery"" by David Grann."
Rank:540 Metascore:,American Pastoral (2016),Crime,Drama,,Ewan,McGregor,Ewan McGregor, Jennifer Connelly, Dakota Fanning, Peter Riegert,108,,6.1|7115|,An All-American college star and his beauty queen wife watch their seemingly perfect life fall apart as their daughter joins the turmoil of '60s America.
Rank:541 Metascore:77,The Ghost Writer (2010),Mystery,Thriller,,Roman,Polanski,Ewan McGregor, Pierce Brosnan, Olivia Williams,Jon Bernthal,128,15.52,7.2|137964|77,A ghostwriter hired to complete the memoirs of a former British prime minister uncovers secrets that put his own life in jeopardy.
Rank:542 Metascore:59,Limitless (2011),Mystery,Sci-Fi,Thriller,Neil,Burger,Bradley Cooper, Anna Friel, Abbie Cornish, Robert De Niro,105,79.24,7.4|444417|59,"With the help of a mysterious pill that enables the user to access 100 percent of his brain abilities, a struggling writer becomes a financial wizard, but it also puts him in a new world with lots of dangers."
Rank:543 Metascore:39,Spectral (2016),Action,Mystery,Sci-Fi,Nic,Mathieu,James Badge Dale, Emily Mortimer, Bruce Greenwood,Max Martini,107,,6.3|27042|39,A sci-fi/thriller story centered on a special-ops team that is dispatched to fight supernatural beings.
Rank:544 Metascore:,P.S. I Love You (2007),Drama,Romance,,Richard,LaGravenese,Hilary Swank, Gerard Butler, Harry Connick Jr., Lisa Kudrow,126,53.68,7.1|177247|,A young widow discovers that her late husband has left her 10 messages intended to help ease her pain and start a new life.
Rank:545 Metascore:39,Zipper (2015),Drama,Thriller,,Mora,Stephens,Patrick Wilson, Lena Headey, Ray Winstone,Richard Dreyfuss,103,,5.7|4912|39,A successful family man with a blossoming political career loses all sense of morality when he becomes addicted to using an escort agency.
Rank:546 Metascore:76,Midnight Special (2016),Drama,Mystery,Sci-Fi,Jeff,Nichols,Michael Shannon, Joel Edgerton, Kirsten Dunst, Adam Driver,112,3.71,6.7|54787|76,"A father and son go on the run, pursued by the government and a cult drawn to the child's special powers."
Rank:547 Metascore:83,Don't Think Twice (2016),Comedy,Drama,,Mike,Birbiglia,Keegan-Michael Key, Gillian Jacobs, Mike Birbiglia,Chris Gethard,92,4.42,6.8|10485|83,"When a member of a popular New York City improv troupe gets a huge break, the rest of the group - all best friends - start to realize that not everyone is going to make it after all."
Rank:548 Metascore:53,Alice in Wonderland (2010),Adventure,Family,Fantasy,Tim,Burton,Mia Wasikowska, Johnny Depp, Helena Bonham Carter,Anne Hathaway,108,334.19,6.5|324898|53,"Nineteen-year-old Alice returns to the magical world from her childhood adventure, where she reunites with her old friends and learns of her true destiny: to end the Red Queen's reign of terror."
