Rank|Metascore,Title & Year,Genre1,Genre2,Genre3,Director FirstN,Director SecondN,Actor1,Actor2,Actor3,Actor4,Runtime (Minutes),Revenue (Millions),Rating|Votes|Metascore,Description
Rank:709 Metascore:48,The Judge (2014),Crime,Drama,,David,Dobkin,Robert Downey Jr., Robert Duvall, Vera Farmiga, Billy Bob Thornton,141,47.11,7.4|146812|48,"Big-city lawyer Hank Palmer returns to his childhood home where his father, the town's judge, is suspected of murder. Hank sets out to discover the truth and, along the way, reconnects with his estranged family."
Rank:710 Metascore:50,Closed Circuit (2013),Crime,Drama,Mystery,John,Crowley,Eric Bana, Rebecca Hall, Jim Broadbent, Ciarán Hinds,96,5.73,6.2|18437|50,A high-profile terrorism case unexpectedly binds together two ex-lovers on the defense team - testing the limits of their loyalties and placing their lives in jeopardy.
Rank:711 Metascore:35,Transformers: Revenge of the Fallen (2009),Action,Adventure,Sci-Fi,Michael,Bay,Shia LaBeouf, Megan Fox, Josh Duhamel, Tyrese Gibson,150,402.08,6|335757|35,"Sam Witwicky leaves the Autobots behind for a normal life. But when his mind is filled with cryptic symbols, the Decepticons target him and he is dragged back into the Transformers' war."
Rank:712 Metascore:86,La tortue rouge (2016),Animation,Fantasy,,Michael Dudok,de Wit,Emmanuel Garijo, Tom Hudson, Baptiste Goy, Axel Devillers,80,0.92,7.6|11482|86,"A man is shipwrecked on a deserted island and encounters a red turtle, which changes his life."
Rank:713 Metascore:67,The Book of Life (2014),Animation,Adventure,Comedy,Jorge R.,Gutiérrez,Diego Luna, Zoe Saldana, Channing Tatum, Ron Perlman,95,50.15,7.3|50388|67,"Manolo, a young man who is torn between fulfilling the expectations of his family and following his heart, embarks on an adventure that spans three fantastic worlds where he must face his greatest fears."
Rank:714 Metascore:80,Incendies (2010),Drama,Mystery,War,Denis,Villeneuve,Lubna Azabal, Mélissa Désormeaux-Poulin, Maxim Gaudette, Mustafa Kamel,131,6.86,8.2|92863|80,"Twins journey to the Middle East to discover their family history, and fulfill their mother's last wishes."
Rank:715 Metascore:46,The Heartbreak Kid (2007),Comedy,Romance,,Bobby,Farrelly,Ben Stiller, Michelle Monaghan,Malin Akerman, Jerry Stiller,116,36.77,5.8|74664|46,A newly wed man who believes he's just gotten hitched to the perfect woman encounters another lady on his honeymoon.
Rank:716 Metascore:77,Happy Feet (2006),Animation,Comedy,Family,George,Miller,Elijah Wood, Brittany Murphy, Hugh Jackman, Robin Williams,108,197.99,6.5|141141|77,"Into the world of the Emperor Penguins, who find their soul mates through song, a penguin is born who cannot sing. But he can tap dance something fierce!"
Rank:717 Metascore:38,Entourage (2015),Comedy,,,Doug,Ellin,Adrian Grenier, Kevin Connolly, Jerry Ferrara, Kevin Dillon,104,32.36,6.6|64557|38,"Movie star Vincent Chase, together with his boys Eric, Turtle, and Johnny, are back - and back in business with super agent-turned-studio head Ari Gold on a risky project that will serve as Vince's directorial debut."
Rank:718 Metascore:47,The Strangers (2008),Horror,Mystery,Thriller,Bryan,Bertino,Scott Speedman, Liv Tyler, Gemma Ward, Alex Fisher,86,52.53,6.2|96718|47,A young couple staying in an isolated vacation home are terrorized by three unknown assailants.
Rank:719 Metascore:68,Noah (2014),Action,Adventure,Drama,Darren,Aronofsky,Russell Crowe, Jennifer Connelly, Anthony Hopkins, Emma Watson,138,101.16,5.8|209700|68,A man is chosen by his world's creator to undertake a momentous mission before an apocalyptic flood cleanses the world.
Rank:720 Metascore:68,Neighbors (2014),Comedy,,,Nicholas,Stoller,Seth Rogen, Rose Byrne, Zac Efron, Lisa Kudrow,97,150.06,6.4|236500|68,"After they are forced to live next to a fraternity house, a couple with a newborn baby do whatever they can to take them down."
Rank:721 Metascore:60,Nymphomaniac: Vol. II (2013),Drama,,,Lars,von Trier,Charlotte Gainsbourg, Stellan Skarsgård, Willem Dafoe, Jamie Bell,123,0.33,6.7|65824|60,"The continuation of Joe's sexually dictated life delves into the darker aspects of her adulthood, obsessions and what led to her being in Seligman's care."
Rank:722 Metascore:76,Wild (2014),Adventure,Biography,Drama,Jean-Marc,Vallée,Reese Witherspoon, Laura Dern, Gaby Hoffmann,Michiel Huisman,115,37.88,7.1|95553|76,"A chronicle of one woman's 1,100-mile solo hike undertaken as a way to recover from a recent personal tragedy."
Rank:723 Metascore:30,Grown Ups (2010),Comedy,,,Dennis,Dugan,Adam Sandler, Salma Hayek, Kevin James, Chris Rock,102,162,6|190385|30,"After their high school basketball coach passes away, five good friends and former teammates reunite for a Fourth of July holiday weekend."
Rank:724 Metascore:47,Blair Witch (2016),Horror,Thriller,,Adam,Wingard,James Allen McCune, Callie Hernandez, Corbin Reid, Brandon Scott,89,20.75,5.1|26088|47,"After discovering a video showing what he believes to be his vanished sister Heather, James and a group of friends head to the forest believed to be inhabited by the Blair Witch."
Rank:725 Metascore:61,The Karate Kid (2010),Action,Drama,Family,Harald,Zwart,Jackie Chan, Jaden Smith, Taraji P. Henson, Wenwen Han,140,176.59,6.2|127983|61,"Work causes a single mother to move to China with her young son; in his new home, the boy embraces kung fu, taught to him by a master."
Rank:726 Metascore:55,Dark Shadows (2012),Comedy,Fantasy,Horror,Tim,Burton,Johnny Depp, Michelle Pfeiffer, Eva Green, Helena Bonham Carter,113,79.71,6.2|209326|55,"An imprisoned vampire, Barnabas Collins, is set free and returns to his ancestral home, where his dysfunctional descendants are in need of his protection."
Rank:727 Metascore:63,Friends with Benefits (2011),Comedy,Romance,,Will,Gluck,Mila Kunis, Justin Timberlake, Patricia Clarkson, Jenna Elfman,109,55.8,6.6|286543|63,"A young man and woman decide to take their friendship to the next level without becoming a couple, but soon discover that adding sex only leads to complications."
Rank:728 Metascore:68,The Illusionist (2006),Drama,Mystery,Romance,Neil,Burger,Edward Norton, Jessica Biel, Paul Giamatti, Rufus Sewell,110,39.83,7.6|309934|68,"In turn-of-the-century Vienna, a magician uses his abilities to secure the love of a woman far above his social standing."
Rank:729 Metascore:47,The A-Team (2010),Action,Adventure,Comedy,Joe,Carnahan,Liam Neeson, Bradley Cooper, Sharlto Copley,Jessica Biel,117,77.21,6.8|219116|47,"A group of Iraq War veterans looks to clear their name with the U.S. military, who suspect the four men of committing a crime for which they were framed."
Rank:730 Metascore:76,The Guest (2014),Thriller,,,Adam,Wingard,Dan Stevens, Sheila Kelley, Maika Monroe, Joel David Moore,100,0.32,6.7|71069|76,"A soldier introduces himself to the Peterson family, claiming to be a friend of their son who died in action. After the young man is welcomed into their home, a series of accidental deaths seem to be connected to his presence."
Rank:731 Metascore:42,The Internship (2013),Comedy,,,Shawn,Levy,Vince Vaughn, Owen Wilson, Rose Byrne, Aasif Mandvi,119,44.67,6.3|166342|42,"Two salesmen whose careers have been torpedoed by the digital age find their way into a coveted internship at Google, where they must compete with a group of young, tech-savvy geniuses for a shot at employment."
Rank:732 Metascore:57,Paul (2011),Adventure,Comedy,Sci-Fi,Greg,Mottola,Simon Pegg, Nick Frost, Seth Rogen, Mia Stallard,104,37.37,7|201707|57,Two British comic-book geeks traveling across the U.S. encounter an alien outside Area 51.
Rank:733 Metascore:51,This Beautiful Fantastic (2016),Comedy,Drama,Fantasy,Simon,Aboud,Jessica Brown Findlay, Andrew Scott, Jeremy Irvine,Tom Wilkinson,100,,6.9|688|51,"A young woman who dreams of being a children's author makes an unlikely friendship with a cantankerous, rich old widower."
Rank:734 Metascore:46,The Da Vinci Code (2006),Mystery,Thriller,,Ron,Howard,Tom Hanks, Audrey Tautou, Jean Reno, Ian McKellen,149,217.54,6.6|338280|46,A murder inside the Louvre and clues in Da Vinci paintings lead to the discovery of a religious mystery protected by a secret society for two thousand years -- which could shake the foundations of Christianity.
Rank:735 Metascore:37,Mr. Church (2016),Comedy,Drama,,Bruce,Beresford,Eddie Murphy, Britt Robertson, Natascha McElhone, Xavier Samuel,104,0.69,7.7|16163|37,"""Mr. Church"" tells the story of a unique friendship that develops when a little girl and her dying mother retain the services of a talented cook - Henry Joseph Church. What begins as a six month arrangement instead spans into fifteen years and creates a family bond that lasts forever."
Rank:736 Metascore:83,Hugo (2011),Adventure,Drama,Family,Martin,Scorsese,Asa Butterfield, Chloë Grace Moretz, Christopher Lee, Ben Kingsley,126,73.82,7.5|259182|83,"In Paris in 1931, an orphan named Hugo Cabret who lives in the walls of a train station is wrapped up in a mystery involving his late father and an automaton."
Rank:737 Metascore:68,The Blackcoat's Daughter (2015),Horror,Thriller,,Oz,Perkins,Emma Roberts, Kiernan Shipka, Lauren Holly, Lucy Boynton,93,0.02,5.6|4155|68,Two girls must battle a mysterious evil force when they get left behind at their boarding school over winter break.
Rank:738 Metascore:57,Body of Lies (2008),Action,Drama,Romance,Ridley,Scott,Leonardo DiCaprio, Russell Crowe, Mark Strong,Golshifteh Farahani,128,39.38,7.1|182305|57,A CIA agent on the ground in Jordan hunts down a powerful terrorist leader while being caught between the unclear intentions of his American supervisors and Jordan Intelligence.
Rank:739 Metascore:53,Knight of Cups (2015),Drama,Romance,,Terrence,Malick,Christian Bale, Cate Blanchett, Natalie Portman,Brian Dennehy,118,0.56,5.7|17439|53,A writer indulging in all that Los Angeles and Las Vegas has to offer undertakes a search for love and self via a series of adventures with six different women.
Rank:740 Metascore:31,The Mummy: Tomb of the Dragon Emperor (2008),Action,Adventure,Fantasy,Rob,Cohen,Brendan Fraser, Jet Li, Maria Bello, Michelle Yeoh,112,102.18,5.2|124554|31,"In the Far East, Alex O'Connell, the son of famed mummy fighters Rick and Evy O'Connell, unearths the mummy of the first Emperor of Qin -- a shape-shifting entity cursed by a witch centuries ago."
Rank:741 Metascore:40,The Boss (2016),Comedy,,,Ben,Falcone,Melissa McCarthy, Kristen Bell, Peter Dinklage, Ella Anderson,99,63.03,5.4|29642|40,"A titan of industry is sent to prison after she's caught insider trading. When she emerges ready to rebrand herself as America's latest sweetheart, not everyone she screwed over is so quick to forgive and forget."
Rank:742 Metascore:54,Hands of Stone (2016),Action,Biography,Drama,Jonathan,Jakubowicz,Edgar Ramírez, Usher Raymond, Robert De Niro, Rubén Blades,111,4.71,6.6|8998|54,The legendary Roberto Duran and his equally legendary trainer Ray Arcel change each other's lives.
Rank:743 Metascore:80,El secreto de sus ojos (2009),Drama,Mystery,Romance,Juan José,Campanella,Ricardo Darín, Soledad Villamil, Pablo Rago,Carla Quevedo,129,20.17,8.2|144524|80,A retired legal counselor writes a novel hoping to find closure for one of his past unresolved homicide cases and for his unreciprocated love with his superior - both of which still haunt him decades later.
Rank:744 Metascore:80,True Grit (2010),Adventure,Drama,Western,Ethan,Coen,Jeff Bridges, Matt Damon, Hailee Steinfeld,Josh Brolin,110,171.03,7.6|254904|80,A tough U.S. Marshal helps a stubborn teenager track down her father's murderer.
Rank:745 Metascore:46,We Are Your Friends (2015),Drama,Music,Romance,Max,Joseph,Zac Efron, Wes Bentley, Emily Ratajkowski, Jonny Weston,96,3.59,6.2|25903|46,"Caught between a forbidden romance and the expectations of his friends, aspiring DJ Cole Carter attempts to find the path in life that leads to fame and fortune."
Rank:746 Metascore:44,A Million Ways to Die in the West (2014),Comedy,Romance,Western,Seth,MacFarlane,Seth MacFarlane, Charlize Theron, Liam Neeson,Amanda Seyfried,116,42.62,6.1|144779|44,"As a cowardly farmer begins to fall for the mysterious new woman in town, he must put his new-found courage to the test when her husband, a notorious gun-slinger, announces his arrival."
Rank:747 Metascore:60,Only for One Night (2016),Thriller,,,Chris,Stokes,Brian White, Karrueche Tran, Angelique Pereira,Jessica Vanessa DeLeon,86,,4.6|313|60,A married womans husband with a perfect life cheats with her sister with extreme consequences befalling them all.
Rank:748 Metascore:,Rules Don't Apply (2016),Comedy,Drama,Romance,Warren,Beatty,Lily Collins, Haley Bennett, Taissa Farmiga, Steve Tom,127,3.65,5.7|3731|,"The unconventional love story of an aspiring actress, her determined driver, and their boss, eccentric billionaire Howard Hughes."
Rank:749 Metascore:65,Ouija: Origin of Evil (2016),Horror,Thriller,,Mike,Flanagan,Elizabeth Reaser, Lulu Wilson, Annalise Basso,Henry Thomas,99,34.9,6.1|30035|65,"In 1967 Los Angeles, a widowed mother and her 2 daughters add a new stunt to bolster their seance scam business, inviting an evil presence into their home."
Rank:750 Metascore:39,Percy Jackson: Sea of Monsters (2013),Adventure,Family,Fantasy,Thor,Freudenthal,Logan Lerman, Alexandra Daddario, Brandon T. Jackson, Nathan Fillion,106,68.56,5.9|91684|39,"In order to restore their dying safe haven, the son of Poseidon and his friends embark on a quest to the Sea of Monsters to find the mythical Golden Fleece while trying to stop an ancient evil from rising."
Rank:751 Metascore:68,Fracture (2007),Crime,Drama,Mystery,Gregory,Hoblit,Anthony Hopkins, Ryan Gosling, David Strathairn,Rosamund Pike,113,39,7.2|148943|68,"An attorney, intent on climbing the career ladder toward success, finds an unlikely opponent in a manipulative criminal he is trying to prosecute."
Rank:752 Metascore:61,Oculus (2013),Horror,Mystery,,Mike,Flanagan,Karen Gillan, Brenton Thwaites, Katee Sackhoff,Rory Cochrane,104,27.69,6.5|92875|61,"A woman tries to exonerate her brother, who was convicted of murder, by proving that the crime was committed by a supernatural phenomenon."
Rank:753 Metascore:67,In Bruges (2008),Comedy,Crime,Drama,Martin,McDonagh,Colin Farrell, Brendan Gleeson, Ciarán Hinds,Elizabeth Berrington,107,7.76,7.9|322536|67,"Guilt-stricken after a job gone wrong, hitman Ray and his partner await orders from their ruthless boss in Bruges, Belgium, the last place in the world Ray wants to be."
Rank:754 Metascore:31,This Means War (2012),Action,Comedy,Romance,McG,,Reese Witherspoon, Chris Pine, Tom Hardy, Til Schweiger,103,54.76,6.3|154400|31,Two top CIA operatives wage an epic battle against one another after they discover they are dating the same woman.
Rank:755 Metascore:64,Lída Baarová (2016),Biography,Drama,History,Filip,Renc,Tatiana Pauhofová, Karl Markovics, Gedeon Burkhard,Simona Stasová,106,,5|353|64,A film about the black-and-white era actress Lída Baarová and her doomed love affair.
Rank:756 Metascore:,The Road (2009),Adventure,Drama,,John,Hillcoat,Viggo Mortensen, Charlize Theron, Kodi Smit-McPhee,Robert Duvall,111,0.06,7.3|187302|,"In a dangerous post-apocalyptic world, an ailing father defends his son as they slowly travel to the sea."
Rank:757 Metascore:46,Lavender (2016),Drama,Thriller,,Ed,Gass-Donnelly,Abbie Cornish, Dermot Mulroney, Justin Long,Diego Klattenhoff,92,,5.2|2083|46,"After losing her memory, a woman begins to see unexplained things after her psychiatrist suggests she visit her childhood home."
Rank:758 Metascore:36,Deuces (2016),Drama,,,Jamal,Hill,Larenz Tate, Meagan Good, Rotimi, Rick Gonzalez,87,,6.6|256|36,An agent infiltrates a crime ring ran by a charismatic boss.
Rank:759 Metascore:,Conan the Barbarian (2011),Action,Adventure,Fantasy,Marcus,Nispel,Jason Momoa, Ron Perlman, Rose McGowan,Stephen Lang,113,21.27,5.2|84893|,A vengeful barbarian warrior sets off to get his revenge on the evil warlord who attacked his village and murdered his father when he was a boy.
Rank:760 Metascore:79,The Fighter (2010),Action,Biography,Drama,David O.,Russell,Mark Wahlberg, Christian Bale, Amy Adams,Melissa Leo,116,93.57,7.8|290056|79,"A look at the early years of boxer ""Irish"" Micky Ward and his brother who helped train him before going pro in the mid 1980s."
Rank:761 Metascore:38,August Rush (2007),Drama,Music,,Kirsten,Sheridan,Freddie Highmore, Keri Russell, Jonathan Rhys Meyers, Terrence Howard,114,31.66,7.5|91229|38,"A drama with fairy tale elements, where an orphaned musical prodigy uses his gift as a clue to finding his birth parents."
Rank:762 Metascore:68,Chef (2014),Comedy,Drama,,Jon,Favreau,Jon Favreau, Robert Downey Jr., Scarlett Johansson,Dustin Hoffman,114,31.24,7.3|151970|68,"A head chef quits his restaurant job and buys a food truck in an effort to reclaim his creative promise, while piecing back together his estranged family."
Rank:763 Metascore:73,Eye in the Sky (2015),Drama,Thriller,War,Gavin,Hood,Helen Mirren, Aaron Paul, Alan Rickman, Barkhad Abdi,102,18.7,7.3|57826|73,"Col. Katherine Powell, a military officer in command of an operation to capture terrorists in Kenya, sees her mission escalate when a girl enters the kill zone triggering an international dispute over the implications of modern warfare."
Rank:764 Metascore:43,Eagle Eye (2008),Action,Mystery,Thriller,D.J.,Caruso,Shia LaBeouf, Michelle Monaghan, Rosario Dawson,Michael Chiklis,118,101.11,6.6|156158|43,"Jerry and Rachel are two strangers thrown together by a mysterious phone call from a woman they have never met. Threatening their lives and family, she pushes Jerry and Rachel into a series of increasingly dangerous situations, using the technology of everyday life to track and control their every move."
Rank:765 Metascore:41,The Purge (2013),Horror,Sci-Fi,Thriller,James,DeMonaco,Ethan Hawke, Lena Headey, Max Burkholder,Adelaide Kane,85,64.42,5.7|154588|41,"A wealthy family are held hostage for harboring the target of a murderous syndicate during the Purge, a 12-hour period in which any and all crime is legal."
Rank:766 Metascore:51,PK (2014),Comedy,Drama,Romance,Rajkumar,Hirani,Aamir Khan, Anushka Sharma, Sanjay Dutt,Boman Irani,153,10.57,8.2|103279|51,"A stranger in the city asks questions no one has asked before. His childlike curiosity will take him on a journey of love, laughter, and letting go."
Rank:767 Metascore:,Ender's Game (2013),Action,Sci-Fi,,Gavin,Hood,Harrison Ford, Asa Butterfield, Hailee Steinfeld, Abigail Breslin,114,61.66,6.7|194236|,"Young Ender Wiggin is recruited by the International Military to lead the fight against the Formics, a genocidal alien race which nearly annihilated the human race in a previous invasion."
Rank:768 Metascore:65,Indiana Jones and the Kingdom of the Crystal Skull (2008),Action,Adventure,Fantasy,Steven,Spielberg,Harrison Ford, Cate Blanchett, Shia LaBeouf,Karen Allen,122,317.01,6.2|351361|65,"Famed archaeologist/adventurer Dr. Henry ""Indiana"" Jones is called back into action when he becomes entangled in a Soviet plot to uncover the secret behind mysterious artifacts known as the Crystal Skulls."
Rank:769 Metascore:56,Paper Towns (2015),Drama,Mystery,Romance,Jake,Schreier,Nat Wolff, Cara Delevingne, Austin Abrams, Justice Smith,109,31.99,6.3|72515|56,"After an all night adventure, Quentin's life-long crush, Margo, disappears, leaving behind clues that Quentin and his friends follow on the journey of a lifetime."
Rank:770 Metascore:65,High-Rise (2015),Drama,,,Ben,Wheatley,Tom Hiddleston, Jeremy Irons, Sienna Miller, Luke Evans,119,0.34,5.7|25928|65,Life for the residents of a tower block begins to run out of control.
Rank:771 Metascore:58,Quantum of Solace (2008),Action,Adventure,Thriller,Marc,Forster,Daniel Craig, Olga Kurylenko, Mathieu Amalric, Judi Dench,106,168.37,6.6|347798|58,"James Bond descends into mystery as he tries to stop a mysterious organization from eliminating a country's most valuable resource. All the while, he still tries to seek revenge over the death of his love."
Rank:772 Metascore:34,The Assignment (2016),Action,Crime,Thriller,Walter,Hill,Sigourney Weaver, Michelle Rodriguez, Tony Shalhoub,Anthony LaPaglia,95,,4.5|2043|34,"After waking up and discovering that he has undergone gender reassignment surgery, an assassin seeks to find the doctor responsible."
Rank:773 Metascore:74,How to Train Your Dragon (2010),Animation,Action,Adventure,Dean,DeBlois,Jay Baruchel, Gerard Butler,Christopher Mintz-Plasse, Craig Ferguson,98,217.39,8.1|523893|74,"A hapless young Viking who aspires to hunt dragons becomes the unlikely friend of a young dragon himself, and learns there may be more to the creatures than he assumed."
Rank:774 Metascore:36,Lady in the Water (2006),Drama,Fantasy,Mystery,M. Night,Shyamalan,Paul Giamatti, Bryce Dallas Howard, Jeffrey Wright, Bob Balaban,110,42.27,5.6|82701|36,"Apartment building superintendent Cleveland Heep rescues what he thinks is a young woman from the pool he maintains. When he discovers that she is actually a character from a bedtime story who is trying to make the journey back to her home, he works with his tenants to protect his new friend from the creatures that are determined to keep her in our world."
Rank:775 Metascore:51,The Fountain (2006),Drama,Sci-Fi,,Darren,Aronofsky,Hugh Jackman, Rachel Weisz, Sean Patrick Thomas, Ellen Burstyn,96,10.14,7.3|199193|51,"As a modern-day scientist, Tommy is struggling with mortality, desperately searching for the medical breakthrough that will save the life of his cancer-stricken wife, Izzi."
Rank:776 Metascore:57,Cars 2 (2011),Animation,Adventure,Comedy,John,Lasseter,Owen Wilson, Larry the Cable Guy,Michael Caine, Emily Mortimer,106,191.45,6.2|110490|57,Star race car Lightning McQueen and his pal Mater head overseas to compete in the World Grand Prix race. But the road to the championship becomes rocky as Mater gets caught up in an intriguing adventure of his own: international espionage.
Rank:777 Metascore:35,31 (2016),Horror,Thriller,,Rob,Zombie,Malcolm McDowell, Richard Brake, Jeff Daniel Phillips,Sheri Moon Zombie,102,0.78,5.1|10871|35,"Five carnival workers are kidnapped and held hostage in an abandoned, Hell-like compound where they are forced to participate in a violent game, the goal of which is to survive twelve hours against a gang of sadistic clowns."
Rank:778 Metascore:56,Final Girl (2015),Action,Thriller,,Tyler,Shields,Abigail Breslin, Wes Bentley, Logan Huffman,Alexander Ludwig,90,,4.7|9026|56,A man teaches a young woman how to become a complete weapon. Later she is approached by a group of sadistic teens who kill blonde women for unknown reasons. The hunting season begins.
Rank:779 Metascore:,Chalk It Up (2016),Comedy,,,Hisonni,Johnson,Maddy Curley, John DeLuca, Nikki SooHoo, Drew Seeley,90,,4.8|499|,"When a super girly-girl is dumped by her boyfriend; she decides to do everything she can to get him back by building a college gymnastics team, quickly learning that she is capable of a lot more than just getting an MRS degree."
Rank:780 Metascore:,The Man Who Knew Infinity (2015),Biography,Drama,,Matt,Brown,Dev Patel, Jeremy Irons, Malcolm Sinclair, Raghuvir Joshi,108,3.86,7.2|29912|,"The story of the life and academic career of the pioneer Indian mathematician, Srinivasa Ramanujan, and his friendship with his mentor, Professor G.H. Hardy."
Rank:781 Metascore:56,Unknown (2011),Action,Mystery,Thriller,Jaume,Collet-Serra,Liam Neeson, Diane Kruger, January Jones,Aidan Quinn,113,61.09,6.9|218679|56,"A man awakens from a coma, only to discover that someone has taken on his identity and that no one, (not even his wife), believes him. With the help of a young woman, he sets out to prove who he is."
Rank:782 Metascore:34,Self/less (2015),Action,Mystery,Sci-Fi,Tarsem,Singh,Ryan Reynolds, Natalie Martinez, Matthew Goode,Ben Kingsley,117,12.28,6.5|67196|34,"A dying real estate mogul transfers his consciousness into a healthy young body, but soon finds that neither the procedure nor the company that performed it are quite what they seem."
Rank:783 Metascore:45,Mr. Brooks (2007),Crime,Drama,Thriller,Bruce A.,Evans,Kevin Costner, Demi Moore, William Hurt, Dane Cook,120,28.48,7.3|128146|45,A psychological thriller about a man who is sometimes controlled by his murder-and-mayhem-loving alter ego.
Rank:784 Metascore:77,Tramps (2016),Comedy,Romance,,Adam,Leon,Callum Turner, Grace Van Patten, Michal Vondel, Mike Birbiglia,82,,6.5|1031|77,A young man and woman find love in an unlikely place while carrying out a shady deal.
Rank:785 Metascore:31,Before We Go (2014),Comedy,Drama,Romance,Chris,Evans,Chris Evans, Alice Eve, Emma Fitzpatrick, John Cullum,95,0.04,6.9|31370|31,Two strangers stuck in Manhattan for the night grow into each other's most trusted confidants when an evening of unexpected adventure forces them to confront their fears and take control of their lives.
Rank:786 Metascore:83,Captain Phillips (2013),Biography,Drama,Thriller,Paul,Greengrass,Tom Hanks, Barkhad Abdi, Barkhad Abdirahman,Catherine Keener,134,107.1,7.8|346154|83,"The true story of Captain Richard Phillips and the 2009 hijacking by Somali pirates of the U.S.-flagged MV Maersk Alabama, the first American cargo ship to be hijacked in two hundred years."
Rank:787 Metascore:37,The Secret Scripture (2016),Drama,,,Jim,Sheridan,Rooney Mara, Eric Bana, Theo James, Aidan Turner,108,,6.8|378|37,A woman keeps a diary of her extended stay at a mental hospital.
Rank:788 Metascore:22,Max Steel (2016),Action,Adventure,Family,Stewart,Hendler,Ben Winchell, Josh Brener, Maria Bello, Andy Garcia,92,3.77,4.6|11555|22,"The adventures of teenager Max McGrath and his alien companion, Steel, who must harness and combine their tremendous new powers to evolve into the turbo-charged superhero Max Steel."
